batch_item_id,pair_id,phenomenon,s,s_cf,annotation_prompt_version
1,attach_000192,attachment,The researcher saw the man with the telescope.,The researcher saw the man who had the telescope.,css_human_change_v1
2,neg_000769,negation,A raccoon is an animal.,A raccoon is not a bird.,css_human_change_v1
3,role_000514,role_reversal,The teacher asked which student the bully had threatened.,The teacher asked which bully the student had fought.,css_human_change_v1
4,neg_001275,negation,An ox is an animal.,An ox is not a plant.,css_human_change_v1
5,attach_000787,attachment,"With the flashlight, the student checked the driver.",The student checked the driver who had the flashlight.,css_human_change_v1
6,attach_001091,attachment,The musician observed the scientist with the microscope.,"With the microscope, the musician observed the scientist.",css_human_change_v1
7,role_000693,role_reversal,The teacher knew which student the bully had pushed.,The teacher knew which bully the student had reported.,css_human_change_v1
8,neg_000238,negation,A frog is not a reptile.,A frog is an amphibian.,css_human_change_v1
9,role_000786,role_reversal,The poet showed which writer the novelist had admired.,The poet showed which novelist the writer had admired.,css_human_change_v1
10,neg_001121,negation,A laptop is a computer.,A laptop is not a phone.,css_human_change_v1
11,neg_001320,negation,A cout is not a plant.,A court is a building.,css_human_change_v1
12,attach_000931,attachment,"With the microscope, the artist observed the scientist.",The artist observed the scientist who had the microscope.,css_human_change_v1
13,role_001345,role_reversal,The athlete remembered which teammate the coach had benched.,The athlete remembered which coach the teammate had berated.,css_human_change_v1
14,attach_000098,attachment,The nurse showed the guide with the map.,"With the map, the nurse showed the guide.",css_human_change_v1
15,role_001352,role_reversal,The gangster recalled which locals the sheriff had robbed.,The gangster recalled which sheriff the locals had feared.,css_human_change_v1
16,attach_000571,attachment,"With the badge, the musician questioned the officer.",The musician questioned the officer who had the badge.,css_human_change_v1
17,role_001234,role_reversal,Brianne realized which singer the musician had inspired.,Brianne realized which musician the singer had copied.,css_human_change_v1
18,attach_001209,attachment,The chef met the student with the notebook.,The chef met the student who had the notebook.,css_human_change_v1
19,attach_000603,attachment,The scientist photographed the tourist with the camera.,The scientist photographed the tourist who had the camera.,css_human_change_v1
20,role_000846,role_reversal,The predators remembered which naturalist the deer had avoided.,The predators remembered which deer the naturalist had eaten.,css_human_change_v1
21,role_000433,role_reversal,The teacher asked which students the substitute had scolded.,The teacher asked which substitute the students had liked.,css_human_change_v1
22,role_000108,role_reversal,The student read which writer the book had written.,The student read which book the writer had written.,css_human_change_v1
23,neg_000808,negation,A squirrel is not an insect.,A squirrel is a mammal.,css_human_change_v1
24,role_001289,role_reversal,The advisor guessed which president the committee had chosen.,The advisor guessed which committee the president had appointed.,css_human_change_v1
25,attach_001028,attachment,The passenger noticed the teacher with the umbrella.,"With the umbrella, the passenger noticed the teacher.",css_human_change_v1
26,role_000725,role_reversal,The teacher asked which students the principal had reported.,The teacher asked which principal the students had voted .,css_human_change_v1
27,role_000524,role_reversal,The philanthropist knew which refugees the aid worker had helped.,The refugees knew which philanthropist the aid worker had thanked.,css_human_change_v1
28,attach_000653,attachment,The judge observed the scientist with the microscope.,"With the microscope, the judge observed the scientist.",css_human_change_v1
29,neg_001271,negation,A loom is a tool.,A loom is not a place.,css_human_change_v1
30,neg_001125,negation,A castle is a building.,A castle is not a fish.,css_human_change_v1
31,attach_001164,attachment,The teacher noticed the teacher with the umbrella.,The teacher noticed the teacher who had the umbrella.,css_human_change_v1
32,neg_001448,negation,An autobiography is not a chair.,An autobiography is a book.,css_human_change_v1
33,role_000478,role_reversal,The cook noticed which waiter the guest had tipped.,The cook noticed which guest the waiter had served.,css_human_change_v1
34,role_000566,role_reversal,The detective knew which suspect the policeman had arrested.,The detective knew which policeman the suspect had feared.,css_human_change_v1
35,role_000495,role_reversal,The detective remembered which criminal the victim had identified.,The victim remembered which criminal the detective had arrested.,css_human_change_v1
36,attach_001291,attachment,"With the badge, the passenger questioned the officer.",The passenger questioned the officer who had the badge.,css_human_change_v1
37,attach_001251,attachment,The artist showed the guide with the map.,The artist showed the guide who had the map.,css_human_change_v1
38,role_001467,role_reversal,The babysitter knew which toddler the daycare teacher had disciplined.,The babysitter knew which daycare teacher the toddler had bitten.,css_human_change_v1
39,attach_001077,attachment,The chef noticed the teacher with the umbrella.,The chef noticed the teacher who had the umbrella.,css_human_change_v1
40,attach_000468,attachment,The doctor saw the man with the telescope.,The doctor saw the man who had the telescope.,css_human_change_v1
41,role_001169,role_reversal,The model identified which artist she had photographed.,The model identified which photograph the artist had taken.,css_human_change_v1
42,neg_001302,negation,A telescope is not a toy.,A telescope is a device.,css_human_change_v1
43,role_001465,role_reversal,The soldier remembered which officer the drill sergeant had captured.,The soldier remembered which drill sergeant the officer had promoted.,css_human_change_v1
44,neg_001259,negation,A platypus is an animal.,A platypus is not a fish.,css_human_change_v1
45,neg_000040,negation,A person is not a reptile.,A person is a mammal.,css_human_change_v1
46,attach_000826,attachment,"With the telescope, the writer saw the man.",The writer saw the man who had the telescope.,css_human_change_v1
47,neg_001030,negation,A library is not a drink.,A library is a building.,css_human_change_v1
48,neg_000907,negation,A methane is a gas.,A methane is not a liquid.,css_human_change_v1
49,attach_000961,attachment,"With the camera, the student photographed the tourist.",The student photographed the tourist who had the camera.,css_human_change_v1
50,role_000645,role_reversal,The waitress forgot which customer the restaurant owner had invited.,The waitress forgot which restaurant owner the customer had seen.,css_human_change_v1
51,neg_000657,negation,A hamburger is a food.,A hamburger is not a clothing.,css_human_change_v1
52,attach_000109,attachment,"With the flashlight, the student checked the driver.",The student checked the driver who had the flashlight.,css_human_change_v1
53,role_000856,role_reversal,The salesclerk understood which blouse the shopper had selected.,The salesclerk understood which shopper the blouse had fit.,css_human_change_v1
54,neg_000832,negation,A lever is not a toy.,A lever is a machine.,css_human_change_v1
55,role_000208,role_reversal,The girl reported which woods the monster had been.,The girl reported which monster she had seen.,css_human_change_v1
56,neg_001096,negation,A saw is not a place.,A saw is an instrument.,css_human_change_v1
57,attach_000347,attachment,The musician photographed the tourist with the camera.,"With the camera, the musician photographed the tourist.",css_human_change_v1
58,role_000707,role_reversal,The teacher asked which student the teacher had scolded.,The teacher asked which teacher the student had reported.,css_human_change_v1
59,neg_000056,negation,A squirrel is not a mineral.,A squirrel is an animal.,css_human_change_v1
60,attach_000612,attachment,The researcher photographed the tourist with the camera.,The researcher photographed the tourist who had the camera.,css_human_change_v1
61,attach_000156,attachment,The scientist showed the guide with the map.,The scientist showed the guide who had the map.,css_human_change_v1
62,role_000245,role_reversal,The hunter was saddened to find which animal the dogs had killed.,The hunter was saddened to find which dogs the animal had killed.,css_human_change_v1
63,role_001076,role_reversal,The advisor guessed which president the committee member had appointed.,The advisor guessed which committee member the president had chosen.,css_human_change_v1
64,neg_000788,negation,A panther is not a toy.,A panther is an animal.,css_human_change_v1
65,neg_000129,negation,A snowflake is a crystal.,A snowflake is not a liquid.,css_human_change_v1
66,neg_000336,negation,A fish is not an invertebrate.,A fish is a vertebrate.,css_human_change_v1
67,neg_000868,negation,A ship is not a toy.,A ship is a vehicle.,css_human_change_v1
68,role_000342,role_reversal,The musician recognized which producer the record had entertained.,The musician recognized which record the producer had liked.,css_human_change_v1
69,neg_000128,negation,A pencil is not a tree.,A pencil is a tool.,css_human_change_v1
70,neg_000723,negation,A piano is an instrument.,A piano is not a drink.,css_human_change_v1
71,neg_000240,negation,A diamond is not a toy.,A diamond is a mineral.,css_human_change_v1
72,attach_001025,attachment,The waiter checked the driver with the flashlight.,"With the flashlight, the waiter checked the driver.",css_human_change_v1
73,role_000977,role_reversal,The child learned which custodian the teacher had appointed.,The child learned which teacher the custodian had disciplined.,css_human_change_v1
74,role_000993,role_reversal,The zookeeper mentioned which wildlife curator the ape had liked.,The zookeeper mentioned which ape the wildlife curator had fed.,css_human_change_v1
75,role_000143,role_reversal,The robber threatened which cashier the customer had counted.,The robber threatened which customer the cashier had counted.,css_human_change_v1
76,role_001150,role_reversal,The researcher learned which biologist the whale had eaten.,The researcher learned which whale the biologist had studied.,css_human_change_v1
77,attach_000275,attachment,The driver met the student with the notebook.,"With the notebook, the driver met the student.",css_human_change_v1
78,role_001229,role_reversal,The nanny knew which housekeeper the billionaire had hired.,The nanny knew which billionaire the housekeeper had served.,css_human_change_v1
79,role_000458,role_reversal,The conductor observed which passenger the conductor had removed.,The conductor observed which passenger Jack had seen.,css_human_change_v1
80,neg_000078,negation,A mice is not a toy.,A mice is a rodent.,css_human_change_v1
81,neg_000602,negation,A carrot is not a building.,A carrot is a root.,css_human_change_v1
82,attach_000497,attachment,The passenger met the student with the notebook.,"With the notebook, the passenger met the student.",css_human_change_v1
83,neg_000660,negation,A bean is not a mineral.,A bean is a food.,css_human_change_v1
84,neg_000625,negation,A glock is a gun.,A glock is not a toy.,css_human_change_v1
85,neg_001180,negation,A petz is not a toy.,A petz is an animal.,css_human_change_v1
86,neg_000824,negation,A pencil is not an animal.,A pencil is an instrument.,css_human_change_v1
87,role_000172,role_reversal,The zookeeper guessed which zookeeper the animal had hurt.,The zookeeper guessed which animal the zookeeper had fed.,css_human_change_v1
88,attach_001235,attachment,The artist questioned the officer with the badge.,"With the badge, the artist questioned the officer.",css_human_change_v1
89,attach_000444,attachment,The scientist saw the man with the telescope.,The scientist saw the man who had the telescope.,css_human_change_v1
90,neg_001163,negation,A map is a paper.,A map is not a toy.,css_human_change_v1
91,attach_001441,attachment,"With the umbrella, the waiter noticed the teacher.",The waiter noticed the teacher who had the umbrella.,css_human_change_v1
92,attach_000332,attachment,The manager saw the man with the telescope.,"With the telescope, the manager saw the man.",css_human_change_v1
93,attach_000407,attachment,The student saw the man with the telescope.,"With the telescope, the student saw the man.",css_human_change_v1
94,attach_000973,attachment,"With the microscope, the student observed the scientist.",The student observed the scientist who had the microscope.,css_human_change_v1
95,role_000710,role_reversal,The contestant liked which broadcaster the judge had hired.,The contestant liked which judge the broadcaster had explained.,css_human_change_v1
96,role_000130,role_reversal,The editor decided which reporter the headline had suited.,The editor decided which headline the reporter had written.,css_human_change_v1
97,attach_001248,attachment,The researcher noticed the teacher with the umbrella.,The researcher noticed the teacher who had the umbrella.,css_human_change_v1
98,neg_000846,negation,A brick is not a flower.,A brick is a material.,css_human_change_v1
99,neg_001313,negation,A cap is a clothing.,A cap is not a person.,css_human_change_v1
100,neg_000889,negation,A koala is an animal.,A koala is not a mineral.,css_human_change_v1
101,attach_000554,attachment,The teacher observed the scientist with the microscope.,"With the microscope, the teacher observed the scientist.",css_human_change_v1
102,neg_000480,negation,A vase is not a bird.,A vase is a container.,css_human_change_v1
103,role_000807,role_reversal,The artist realized which musician the crowd had cheered.,The artist realized which crowd the musician had played.,css_human_change_v1
104,attach_001107,attachment,The judge saw the man with the telescope.,The judge saw the man who had the telescope.,css_human_change_v1
105,attach_000169,attachment,"With the camera, the judge photographed the tourist.",The judge photographed the tourist who had the camera.,css_human_change_v1
106,neg_001377,negation,A basenji is a dog.,A basenji is not a cat.,css_human_change_v1
107,neg_001098,negation,A dove is not a reptile.,A dove is a bird.,css_human_change_v1
108,role_000768,role_reversal,The soccer coach realized which referee the players had bribed.,The soccer coach realized which players the referee had penalized.,css_human_change_v1
109,neg_000291,negation,A man is a mammal.,A man is not a reptile.,css_human_change_v1
110,role_001125,role_reversal,The police officer guessed which civilian the suspect had threatened.,The police officer guessed which suspect the civilian had seen.,css_human_change_v1
111,neg_001289,negation,A console is a furniture.,A console is not a building.,css_human_change_v1
112,role_000912,role_reversal,The doctor explained which patient the illness had affected.,The doctor explained which illness the patient had contracted.,css_human_change_v1
113,role_000200,role_reversal,The children saw which bees the flowers had attracted.,The children saw which flowers the bees had pollinated.,css_human_change_v1
114,role_001157,role_reversal,The actress admitted which director the casting agent had scolded.,The actress admitted which casting agent the director had fired.,css_human_change_v1
115,neg_001011,negation,A bowl is a utensil.,A bowl is not a toy.,css_human_change_v1
116,role_001007,role_reversal,The prince documented which historian the assassin had hired.,The prince documented which assassin the historian had killed.,css_human_change_v1
117,neg_001418,negation,A race is not a party.,A race is a competition.,css_human_change_v1
118,neg_000656,negation,A credit-card is not a coin.,A credit-card is a plastic.,css_human_change_v1
119,role_000093,role_reversal,The athlete trained which sport the coach had supported.,The athlete trained which coach the sport had played.,css_human_change_v1
120,neg_000945,negation,A tugboat is a vessel.,A tugboat is not a toy.,css_human_change_v1
121,attach_001321,attachment,"With the camera, the athlete photographed the tourist.",The athlete photographed the tourist who had the camera.,css_human_change_v1
122,role_001449,role_reversal,The assassin documented which historian the queen had hired.,The assassin documented which queen the historian had hired.,css_human_change_v1
123,neg_000318,negation,A hawk is not a fish.,A hawk is a bird.,css_human_change_v1
124,role_001411,role_reversal,The warden guessed which inmate the jailer had beaten.,The warden guessed which jailer the inmate had stabbed.,css_human_change_v1
125,role_001138,role_reversal,The four-year-old knew which hero the dragon had killed.,The four-year-old knew which dragon the hero had slain.,css_human_change_v1
126,attach_001228,attachment,"With the flashlight, the lawyer checked the driver.",The lawyer checked the driver who had the flashlight.,css_human_change_v1
127,neg_001328,negation,A goat is not a person.,A goat is an animal.,css_human_change_v1
128,role_001215,role_reversal,The children recalled which gangsters the police had feared.,The children recalled which police the gangsters had robbed.,css_human_change_v1
129,role_000829,role_reversal,The athlete remembered which coach the other athletes had respected.,The athlete remembered which other athletes the coach had disciplined.,css_human_change_v1
130,attach_000360,attachment,The chef noticed the teacher with the umbrella.,The chef noticed the teacher who had the umbrella.,css_human_change_v1
131,attach_000664,attachment,"With the umbrella, the athlete noticed the teacher.",The athlete noticed the teacher who had the umbrella.,css_human_change_v1
132,neg_000521,negation,A pizza is a food.,A pizza is not a drink.,css_human_change_v1
133,role_001351,role_reversal,The gangster recalled which sheriff the locals had feared.,The gangster recalled which locals the sheriff had robbed.,css_human_change_v1
134,role_000094,role_reversal,The athlete trained which coach the sport had played.,The athlete trained which sport the coach had supported.,css_human_change_v1
135,neg_000655,negation,A credit-card is a plastic.,A credit-card is not a coin.,css_human_change_v1
136,neg_001345,negation,A limousine is a vehicle.,A limousine is not a flower.,css_human_change_v1
137,neg_000865,negation,A soup is a food.,A soup is not a plant.,css_human_change_v1
138,role_001004,role_reversal,The thief knew which policeman the homeowner had called.,The thief knew which homeowner the policeman had interrogated.,css_human_change_v1
139,neg_000094,negation,A deer is not a plant.,A deer is an animal.,css_human_change_v1
140,attach_000668,attachment,The nurse questioned the officer with the badge.,"With the badge, the nurse questioned the officer.",css_human_change_v1
141,attach_000352,attachment,"With the map, the journalist showed the guide.",The journalist showed the guide who had the map.,css_human_change_v1
142,role_000051,role_reversal,The monk remembered which lama the monk had seen.,The monk remembered which monk the lama had seen.,css_human_change_v1
143,role_000591,role_reversal,The breeder recorded which farmhand the goats had lived.,The breeder recorded which goats the farmhand had bred.,css_human_change_v1
144,role_000994,role_reversal,The zookeeper mentioned which ape the wildlife curator had fed.,The zookeeper mentioned which wildlife curator the ape had liked.,css_human_change_v1
145,neg_000586,negation,A car is not a horse.,A car is a transport.,css_human_change_v1
146,attach_001021,attachment,"With the flashlight, the engineer checked the driver.",The engineer checked the driver who had the flashlight.,css_human_change_v1
147,neg_000623,negation,A ruby is a gem.,A ruby is not a metal.,css_human_change_v1
148,role_001219,role_reversal,The guests recorded which innkeeper the travel agent had checked-in.,The guests recorded which travel agent the innkeeper had seen.,css_human_change_v1
149,attach_000121,attachment,"With the camera, the doctor photographed the tourist.",The doctor photographed the tourist who had the camera.,css_human_change_v1
150,role_000607,role_reversal,The teacher asked which student the bully had hit.,The teacher asked which bully the student had punched.,css_human_change_v1
151,neg_000732,negation,A pronoun is not a verb.,A pronoun is a word.,css_human_change_v1
152,neg_001148,negation,A soldier is not a gun.,A soldier is a person.,css_human_change_v1
153,attach_000414,attachment,The engineer questioned the officer with the badge.,The engineer questioned the officer who had the badge.,css_human_change_v1
154,role_001484,role_reversal,The journalist documented which celebrities the TV reporter had interviewed.,The journalist documented which TV reporter the celebrities had avoided.,css_human_change_v1
155,attach_000296,attachment,The musician saw the man with the telescope.,"With the telescope, the musician saw the man.",css_human_change_v1
156,attach_000466,attachment,"With the camera, the scientist photographed the tourist.",The scientist photographed the tourist who had the camera.,css_human_change_v1
157,neg_001317,negation,A court is a room.,A court is not a tree.,css_human_change_v1
158,attach_000382,attachment,"With the camera, the researcher photographed the tourist.",The researcher photographed the tourist who had the camera.,css_human_change_v1
159,attach_000641,attachment,The chef showed the guide with the map.,"With the map, the chef showed the guide.",css_human_change_v1
160,attach_001470,attachment,The researcher noticed the teacher with the umbrella.,The researcher noticed the teacher who had the umbrella.,css_human_change_v1
161,attach_000115,attachment,"With the camera, the teacher photographed the tourist.",The teacher photographed the tourist who had the camera.,css_human_change_v1
162,attach_000279,attachment,The engineer showed the guide with the map.,The engineer showed the guide who had the map.,css_human_change_v1
163,neg_000348,negation,A rat is not a bird.,A rat is a mammal.,css_human_change_v1
164,attach_000493,attachment,"With the flashlight, the teacher checked the driver.",The teacher checked the driver who had the flashlight.,css_human_change_v1
165,neg_001456,negation,A cape is not a drink.,A cape is a clothing.,css_human_change_v1
166,neg_000578,negation,An elephant is not a plant.,An elephant is a herbivore.,css_human_change_v1
167,role_000160,role_reversal,The student graded which teacher the paper had assigned.,The student graded which paper the teacher had written.,css_human_change_v1
168,neg_000021,negation,A house is a building.,A house is not a plant.,css_human_change_v1
169,neg_000023,negation,A school is a building.,A school is not a toy.,css_human_change_v1
170,neg_000592,negation,A wolf is not a person.,A wolf is an animal.,css_human_change_v1
171,role_000462,role_reversal,The assailant recognized which defender the judo master had attacked.,The assailant recognized which judo master the defender had defeated.,css_human_change_v1
172,attach_000563,attachment,The driver showed the guide with the map.,"With the map, the driver showed the guide.",css_human_change_v1
173,attach_001303,attachment,"With the umbrella, the engineer noticed the teacher.",The engineer noticed the teacher who had the umbrella.,css_human_change_v1
174,role_001038,role_reversal,The author wrote which publisher the books had offended.,The author wrote which books the publisher had banned.,css_human_change_v1
175,role_000548,role_reversal,The clown saw which friend the boy had scared.,The clown saw which boy the friend had hired.,css_human_change_v1
176,role_000598,role_reversal,The girl reported which camper the bear had eaten.,The girl reported which bear the camper had seen.,css_human_change_v1
177,role_000159,role_reversal,The student graded which paper the teacher had written.,The student graded which teacher the paper had assigned.,css_human_change_v1
178,attach_001487,attachment,The athlete saw the man with the telescope.,"With the telescope, the athlete saw the man.",css_human_change_v1
179,role_000616,role_reversal,The teacher discovered which principal the student had insulted.,The teacher discovered which student the principal had suspended.,css_human_change_v1
180,attach_001104,attachment,The coach met the student with the notebook.,The coach met the student who had the notebook.,css_human_change_v1
181,neg_000636,negation,A valley is not a house.,A valley is a landform.,css_human_change_v1
182,neg_000493,negation,A trumpet is an instrument.,A trumpet is not a rock.,css_human_change_v1
183,neg_000477,negation,A rose is a plant.,A rose is not a bird.,css_human_change_v1
184,neg_000864,negation,A rice is not a fish.,A rice is a grain.,css_human_change_v1
185,attach_001109,attachment,The journalist photographed the tourist with the camera.,"With the camera, the journalist photographed the tourist.",css_human_change_v1
186,attach_001471,attachment,"With the telescope, the chef saw the man.",The chef saw the man who had the telescope.,css_human_change_v1
187,attach_001162,attachment,"With the camera, the scientist photographed the tourist.",The scientist photographed the tourist who had the camera.,css_human_change_v1
188,neg_000025,negation,A phone is a device.,A phone is not a rock.,css_human_change_v1
189,neg_000327,negation,A lion is a carnivore.,A lion is not a herbivore.,css_human_change_v1
190,neg_000415,negation,A blender is a machine.,A blender is not a toy.,css_human_change_v1
