batch_item_id,pair_id,phenomenon,s,s_cf,annotation_prompt_version
191,role_000551,role_reversal,The soldiers knew which general the military man had respected.,The soldiers knew which military man the general had promoted.,css_human_change_v1
192,role_000858,role_reversal,The cashier saw which security guard the shopper had eluded.,The cashier saw which shopper the security guard had stopped.,css_human_change_v1
193,attach_000996,attachment,The journalist met the student with the notebook.,The journalist met the student who had the notebook.,css_human_change_v1
194,neg_000089,negation,A rabbit is a mammal.,A rabbit is not a bird.,css_human_change_v1
195,attach_001015,attachment,"With the flashlight, the artist checked the driver.",The artist checked the driver who had the flashlight.,css_human_change_v1
196,role_000264,role_reversal,The butler heard which family the guests had come.,The butler heard which guests the family had invited.,css_human_change_v1
197,role_001315,role_reversal,The applicant announced which columnist the celebrity had met.,The applicant announced which celebrity the columnist had interviewed.,css_human_change_v1
198,attach_001024,attachment,"With the flashlight, the teacher checked the driver.",The teacher checked the driver who had the flashlight.,css_human_change_v1
199,neg_000347,negation,A rat is a mammal.,A rat is not a bird.,css_human_change_v1
200,neg_000178,negation,A book is not a furniture.,A book is a literature.,css_human_change_v1
201,neg_000574,negation,A cloud is not a ground.,A cloud is a sky.,css_human_change_v1
202,attach_000388,attachment,"With the microscope, the engineer observed the scientist.",The engineer observed the scientist who had the microscope.,css_human_change_v1
203,role_000411,role_reversal,The cashier knew which customer the robber had chosen.,The cashier knew which robber the customer had chosen.,css_human_change_v1
204,role_001018,role_reversal,The cashier knew which robber the customer had reported.,The cashier knew which customer the robber had chosen.,css_human_change_v1
205,role_000700,role_reversal,The gangsters recalled which sheriff the locals had robbed.,The gangsters recalled which locals the sheriff had feared.,css_human_change_v1
206,role_000033,role_reversal,The biologist concluded that the dog the cat had bitten.,The biologist concluded that the cat the dog had chased.,css_human_change_v1
207,role_000074,role_reversal,The nurse took care of which doctor the patient had talked.,The nurse took care of which patient the doctor had visited.,css_human_change_v1
208,role_001433,role_reversal,The bird watcher saw which hawk the photographer had photographed.,The bird watcher saw which photographer the hawk had attacked.,css_human_change_v1
209,attach_001386,attachment,The doctor saw the man with the telescope.,The doctor saw the man who had the telescope.,css_human_change_v1
210,role_000427,role_reversal,The athlete thanked which fans the journalist had interviewed.,The journalist interviewed which fans the athlete had thanked.,css_human_change_v1
211,attach_000162,attachment,The writer met the student with the notebook.,The writer met the student who had the notebook.,css_human_change_v1
212,role_000175,role_reversal,The policeman arrested which thief the victim had caught.,The policeman arrested which victim the thief had robbed.,css_human_change_v1
213,role_000604,role_reversal,The farmer guessed which cowboy the bull had gored.,The farmer guessed which bull the cowboy had ridden.,css_human_change_v1
214,attach_000320,attachment,The researcher questioned the officer with the badge.,"With the badge, the researcher questioned the officer.",css_human_change_v1
215,attach_000576,attachment,The coach saw the man with the telescope.,The coach saw the man who had the telescope.,css_human_change_v1
216,role_000805,role_reversal,The novelist showed which writer the poet had admired.,The novelist showed which poet the writer had admired.,css_human_change_v1
217,neg_000987,negation,A grapefruit is a fruit.,A grapefruit is not a color.,css_human_change_v1
218,attach_000345,attachment,The lawyer checked the driver with the flashlight.,The lawyer checked the driver who had the flashlight.,css_human_change_v1
219,neg_000095,negation,A whale is a mammal.,A whale is not a reptile.,css_human_change_v1
220,neg_001047,negation,A continent is a landmass.,A continent is not a liquid.,css_human_change_v1
221,role_000573,role_reversal,The customer asked the restaurant owner which waitress had served.,The customer asked the waitress which restaurant owner had tipped.,css_human_change_v1
222,attach_000754,attachment,"With the umbrella, the artist noticed the teacher.",The artist noticed the teacher who had the umbrella.,css_human_change_v1
223,role_001189,role_reversal,The landlady remembered which tenant the plumber had helped.,The landlady remembered which plumber the tenant had hired.,css_human_change_v1
224,attach_000553,attachment,"With the microscope, the doctor observed the scientist.",The doctor observed the scientist who had the microscope.,css_human_change_v1
225,attach_001488,attachment,The musician photographed the tourist with the camera.,The musician photographed the tourist who had the camera.,css_human_change_v1
226,neg_000466,negation,A carnation is not a bee.,A carnation is a flower.,css_human_change_v1
227,attach_000824,attachment,The chef photographed the tourist with the camera.,"With the camera, the chef photographed the tourist.",css_human_change_v1
228,role_000942,role_reversal,The athlete wondered which trainer the coach had interviewed.,The athlete wondered which coach the trainer had selected.,css_human_change_v1
229,attach_001206,attachment,The doctor questioned the officer with the badge.,The doctor questioned the officer who had the badge.,css_human_change_v1
230,attach_000692,attachment,The coach showed the guide with the map.,"With the map, the coach showed the guide.",css_human_change_v1
231,neg_000822,negation,A bed is not a toy.,A bed is a furniture.,css_human_change_v1
232,neg_000709,negation,A spy is a person.,A spy is not a thing.,css_human_change_v1
233,attach_000991,attachment,"With the telescope, the teacher saw the man.",The teacher saw the man who had the telescope.,css_human_change_v1
234,attach_000035,attachment,The nurse observed the scientist with the microscope.,"With the microscope, the nurse observed the scientist.",css_human_change_v1
235,role_001070,role_reversal,The costume designer confirmed which actor the barber had shaved.,The costume designer confirmed which barber the actor had used.,css_human_change_v1
236,role_000554,role_reversal,The ghost remembered which villager the old widower had haunted.,The ghost remembered which old widower the villager had seen.,css_human_change_v1
237,role_000096,role_reversal,The director produced which producer the film had financed.,The director produced which film the producer had distributed.,css_human_change_v1
238,neg_001368,negation,A worm is not a vertebrate.,A worm is an invertebrate.,css_human_change_v1
239,neg_000142,negation,A duck is not a fish.,A duck is a bird.,css_human_change_v1
240,neg_000670,negation,A book is not a fruit.,A book is a story.,css_human_change_v1
241,role_001418,role_reversal,The teacher remembered which bully the child had reported.,The teacher remembered which child the bully had harassed.,css_human_change_v1
242,neg_000380,negation,A sunflower is not a fruit.,A sunflower is a flower.,css_human_change_v1
243,attach_000093,attachment,The journalist questioned the officer with the badge.,The journalist questioned the officer who had the badge.,css_human_change_v1
244,role_001448,role_reversal,The farmer recorded which goats the breeder had bred.,The farmer recorded which farmhand the goats had belonged.,css_human_change_v1
245,role_000242,role_reversal,The mother was happy to hear which teacher the child had praised.,The mother was happy to hear which child the teacher had praised.,css_human_change_v1
246,attach_001193,attachment,The scientist noticed the teacher with the umbrella.,"With the umbrella, the scientist noticed the teacher.",css_human_change_v1
247,attach_001076,attachment,The judge photographed the tourist with the camera.,"With the camera, the judge photographed the tourist.",css_human_change_v1
248,role_000729,role_reversal,The parrot knew which Teresa the neighbor had bought.,The parrot knew which neighbor the Teresa had bitten.,css_human_change_v1
249,neg_000258,negation,A lamp is not a food.,A lamp is a lighting.,css_human_change_v1
250,attach_001013,attachment,The writer showed the guide with the map.,"With the map, the writer showed the guide.",css_human_change_v1
251,attach_000305,attachment,The doctor met the student with the notebook.,"With the notebook, the doctor met the student.",css_human_change_v1
252,neg_000606,negation,A carrot is not a pest.,A carrot is a herb.,css_human_change_v1
253,attach_000828,attachment,The musician observed the scientist with the microscope.,The musician observed the scientist who had the microscope.,css_human_change_v1
254,attach_001050,attachment,The engineer showed the guide with the map.,The engineer showed the guide who had the map.,css_human_change_v1
255,neg_001424,negation,A carp is not a reptile.,A carp is a fish.,css_human_change_v1
256,attach_001035,attachment,The doctor observed the scientist with the microscope.,The doctor observed the scientist who had the microscope.,css_human_change_v1
257,role_001003,role_reversal,The thief knew which homeowner the policeman had interrogated.,The thief knew which policeman the homeowner had called.,css_human_change_v1
258,role_000065,role_reversal,The doctor documented which patient the doctor had examined.,The doctor documented which doctor the patient had seen.,css_human_change_v1
259,role_001111,role_reversal,The athlete remembered which game the coach had benched.,The athlete remembered which coach the game had coached.,css_human_change_v1
260,neg_001303,negation,A mango is a fruit.,A mango is not a vegetable.,css_human_change_v1
261,attach_001397,attachment,The student checked the driver with the flashlight.,"With the flashlight, the student checked the driver.",css_human_change_v1
262,neg_000668,negation,A map is not a story.,A map is a document.,css_human_change_v1
263,role_000581,role_reversal,The pirate kidnapped which singer the opera composer had revealed.,The pirate kidnapped which opera composer had revealed.,css_human_change_v1
264,role_001252,role_reversal,The athlete remembered which team the coach had coached.,The athlete remembered which coach the team had hired.,css_human_change_v1
265,attach_000204,attachment,The musician observed the scientist with the microscope.,The musician observed the scientist who had the microscope.,css_human_change_v1
266,attach_000801,attachment,The musician observed the scientist with the microscope.,The musician observed the scientist who had the microscope.,css_human_change_v1
267,neg_001194,negation,A lemon is not a drink.,A lemon is a fruit.,css_human_change_v1
268,neg_001278,negation,A railroad is not a bus.,A railroad is a transportation.,css_human_change_v1
269,neg_000121,negation,A lamp is a light.,A lamp is not a clock.,css_human_change_v1
270,role_000491,role_reversal,The neighbor knew which parrot Teresa had bought.,The neighbor knew which Teresa the parrot had bitten.,css_human_change_v1
271,attach_000154,attachment,"With the camera, the driver photographed the tourist.",The driver photographed the tourist who had the camera.,css_human_change_v1
272,attach_001196,attachment,The passenger observed the scientist with the microscope.,"With the microscope, the passenger observed the scientist.",css_human_change_v1
273,neg_001279,negation,A mower is a machine.,A mower is not a phone.,css_human_change_v1
274,neg_001115,negation,A jade is a gem.,A jade is not a place.,css_human_change_v1
275,neg_000339,negation,A cathedral is a building.,A cathedral is not a bird.,css_human_change_v1
276,role_000134,role_reversal,The teacher graded which student the principal had praised.,The teacher graded which student the principal had accused.,css_human_change_v1
277,role_000908,role_reversal,The boss asked which whistleblower the underling had spoken.,The boss asked which underling the whistleblower had spoken.,css_human_change_v1
278,neg_000618,negation,A plant is not a mineral.,A plant is a lifeform.,css_human_change_v1
279,neg_001369,negation,A mother is a person.,A mother is not a computer.,css_human_change_v1
280,attach_000064,attachment,"With the telescope, the passenger saw the man.",The passenger saw the man who had the telescope.,css_human_change_v1
281,neg_000912,negation,A cup is not a tool.,A cup is a container.,css_human_change_v1
282,attach_000100,attachment,"With the map, the scientist showed the guide.",The scientist showed the guide who had the map.,css_human_change_v1
283,role_000218,role_reversal,The chef heard which family the guests had come.,The chef heard which guests the family had invited.,css_human_change_v1
284,role_000911,role_reversal,The doctor explained which illness the patient had contracted.,The doctor explained which patient the illness had affected.,css_human_change_v1
285,role_000882,role_reversal,The doctor diagnosed which nurse the patient had seen.,The doctor diagnosed which patient the nurse had treated.,css_human_change_v1
286,neg_001117,negation,A cat is an organism.,A cat is not a mammal.,css_human_change_v1
287,role_000244,role_reversal,The nurse was alarmed to find which doctor the patient had forgotten.,The nurse was alarmed to find which patient the doctor had forgotten.,css_human_change_v1
288,attach_000779,attachment,The chef checked the driver with the flashlight.,"With the flashlight, the chef checked the driver.",css_human_change_v1
289,role_001368,role_reversal,The lord asked which cook the chef had served.,The lord asked which chef the cook had requested.,css_human_change_v1
290,attach_001099,attachment,"With the umbrella, the waiter noticed the teacher.",The waiter noticed the teacher who had the umbrella.,css_human_change_v1
291,neg_001103,negation,A pipe is a tool.,A pipe is not a drink.,css_human_change_v1
292,attach_001037,attachment,The artist checked the driver with the flashlight.,"With the flashlight, the artist checked the driver.",css_human_change_v1
293,attach_001464,attachment,The manager noticed the teacher with the umbrella.,The manager noticed the teacher who had the umbrella.,css_human_change_v1
294,attach_000675,attachment,The athlete photographed the tourist with the camera.,The athlete photographed the tourist who had the camera.,css_human_change_v1
295,neg_000561,negation,A mouse is a pest.,A mouse is not a fish.,css_human_change_v1
296,attach_000982,attachment,"With the map, the scientist showed the guide.",The scientist showed the guide who had the map.,css_human_change_v1
297,attach_001159,attachment,"With the microscope, the journalist observed the scientist.",The journalist observed the scientist who had the microscope.,css_human_change_v1
298,attach_000935,attachment,The scientist questioned the officer with the badge.,"With the badge, the scientist questioned the officer.",css_human_change_v1
299,attach_000555,attachment,The driver met the student with the notebook.,The driver met the student who had the notebook.,css_human_change_v1
300,attach_000887,attachment,The passenger checked the driver with the flashlight.,"With the flashlight, the passenger checked the driver.",css_human_change_v1
